STT,Tiêu đề,Công ty,Lương,Link
78,TTS Công Nghệ Thông Tin Fulltime (Có Mộc+Có Lương),CÔNG TY TNHH CÔNG NGHỆ PHẦN MỀM NASANI,4 - 15 triệu,https://www.topcv.vn/viec-lam/tts-cong-nghe-thong-tin-fulltime-co-moc-co-luong/2109114.html?ta_source=JobSearchList_LinkDetail&u_sr_id=41xKsCt6oTR8qJeOXslC50sXuoOJbolXedZyH5X2_1776614713
79,Trợ Lý Kinh Doanh,CÔNG TY TNHH MTV THE GREEN UNIVERSE,8 - 10 triệu,https://www.topcv.vn/viec-lam/tro-ly-kinh-doanh/2110953.html?ta_source=JobSearchList_LinkDetail&u_sr_id=41xKsCt6oTR8qJeOXslC50sXuoOJbolXedZyH5X2_1776614713
80,Nhân Viên Khai Báo Hải Quan (Nhận Việc Ngay),CÔNG TY TNHH GRAND LANE LOGISTICS,Thoả thuận,https://www.topcv.vn/viec-lam/nhan-vien-khai-bao-hai-quan-nhan-viec-ngay/2110816.html?ta_source=JobSearchList_LinkDetail&u_sr_id=41xKsCt6oTR8qJeOXslC50sXuoOJbolXedZyH5X2_1776614713
81,Nhân Viên Chứng Từ Xuất Nhập Khẩu,CÔNG TY TNHH THƯƠNG MẠI-DỊCH VỤ LONG HƯNG PHÁT,Từ 10 triệu,https://www.topcv.vn/viec-lam/nhan-vien-chung-tu-xuat-nhap-khau/2112240.html?ta_source=JobSearchList_LinkDetail&u_sr_id=41xKsCt6oTR8qJeOXslC50sXuoOJbolXedZyH5X2_1776614713
82,Thực Tập Sinh Content Creator,CÔNG TY TNHH STEVE MILLE,3 - 5 triệu,https://www.topcv.vn/viec-lam/thuc-tap-sinh-content-creator/2106467.html?ta_source=JobSearchList_LinkDetail&u_sr_id=41xKsCt6oTR8qJeOXslC50sXuoOJbolXedZyH5X2_1776614713
83,Chuyên Viên Mua Bán & Khai Thác Tài Sản (Thu Nhập Hấp Dẫn),Công ty TNHH MTV Quản lý nợ và khai thác tài sản VIBAMC,Thoả thuận,https://www.topcv.vn/viec-lam/chuyen-vien-mua-ban-khai-thac-tai-san-thu-nhap-hap-dan/2110354.html?ta_source=JobSearchList_LinkDetail&u_sr_id=41xKsCt6oTR8qJeOXslC50sXuoOJbolXedZyH5X2_1776614713
84,Điều Dưỡng Phòng Khám Thẩm Mỹ,CÔNG TY TNHH THẨM MỸ LINH ANH SAIGON,12 - 158 triệu,https://www.topcv.vn/viec-lam/dieu-duong-phong-kham-tham-my/1860674.html?ta_source=JobSearchList_LinkDetail&u_sr_id=41xKsCt6oTR8qJeOXslC50sXuoOJbolXedZyH5X2_1776614713
85,Nhân Viên Chăm Sóc Khách Hàng (Không Telesales),CÔNG TY TNHH THƯƠNG MẠI DỊCH VỤ NEW ERA FINANCE,8 - 20 triệu,https://www.topcv.vn/viec-lam/nhan-vien-cham-soc-khach-hang-khong-telesales/2109918.html?ta_source=JobSearchList_LinkDetail&u_sr_id=41xKsCt6oTR8qJeOXslC50sXuoOJbolXedZyH5X2_1776614713
86,Thực Tập Sinh Công Nghệ Thông Tin Đào Tạo Có Lương,CÔNG TY TNHH CÔNG NGHỆ PHẦN MỀM NASANI,4 - 10 triệu,https://www.topcv.vn/viec-lam/thuc-tap-sinh-cong-nghe-thong-tin-dao-tao-co-luong/2058921.html?ta_source=JobSearchList_LinkDetail&u_sr_id=41xKsCt6oTR8qJeOXslC50sXuoOJbolXedZyH5X2_1776614713
87,Chuyên Viên Pháp Lý Doanh Nghiệp (Đa Ngành),CÔNG TY TNHH MTV SEN VÀNG VIỆT NAM,Thoả thuận,https://www.topcv.vn/brand/goldenlotusjewelry/tuyen-dung/chuyen-vien-phap-ly-doanh-nghiep-da-nganh-j2110765.html?ta_source=JobSearchList_LinkDetail&u_sr_id=41xKsCt6oTR8qJeOXslC50sXuoOJbolXedZyH5X2_1776614713
88,"Technical Support Engineer (Fixed Night Shift, IT, Up To 30M Total Package)",Công ty TNHH ITECHWX,Thoả thuận,https://www.topcv.vn/viec-lam/technical-support-engineer-fixed-night-shift-it-up-to-30m-total-package/2114902.html?ta_source=JobSearchList_LinkDetail&u_sr_id=41xKsCt6oTR8qJeOXslC50sXuoOJbolXedZyH5X2_1776614713
89,Trưởng Phòng Hành Chính Nhân Sự,Công ty Cổ phần xây dựng Vijako Việt Nam,25 - 40 triệu,https://www.topcv.vn/viec-lam/truong-phong-hanh-chinh-nhan-su/2110064.html?ta_source=JobSearchList_LinkDetail&u_sr_id=41xKsCt6oTR8qJeOXslC50sXuoOJbolXedZyH5X2_1776614713
90,Chuyên Viên Thiết Kế Đồ Họa - Graphic Design (Lương Cứng 15-20TR/Tháng),Công ty Cổ phần Bất động sản TICA LAND,15 - 20 triệu,https://www.topcv.vn/viec-lam/chuyen-vien-thiet-ke-do-hoa-graphic-design-luong-cung-15-20tr-thang/2056729.html?ta_source=JobSearchList_LinkDetail&u_sr_id=41xKsCt6oTR8qJeOXslC50sXuoOJbolXedZyH5X2_1776614713
91,Giám Sát Kinh Doanh/ Sales Supervisor/Giám Sát Bán Hàng,CÔNG TY CỔ PHẦN TẬP ĐOÀN TLC VIỆT NAM,15 - 30 triệu,https://www.topcv.vn/viec-lam/giam-sat-kinh-doanh-sales-supervisor-giam-sat-ban-hang/2111791.html?ta_source=JobSearchList_LinkDetail&u_sr_id=41xKsCt6oTR8qJeOXslC50sXuoOJbolXedZyH5X2_1776614713
92,"Chuyên Viên Xây Dựng & Phát Triển Kênh Online (Thu Nhập 12tr - 14tr), Phỏng Vấn Đi Làm Ngay",CÔNG TY TNHH TRUYỀN THÔNG TTV,12 - 14 triệu,https://www.topcv.vn/viec-lam/chuyen-vien-xay-dung-phat-trien-kenh-online-thu-nhap-12tr-14tr-phong-van-di-lam-ngay/2110293.html?ta_source=JobSearchList_LinkDetail&u_sr_id=41xKsCt6oTR8qJeOXslC50sXuoOJbolXedZyH5X2_1776614713
93,Nhân Viên Thu Ngân - Vận Hành Online/Apps,Công Ty TNHH Thương Mại Laria – Siêu Thị Farmers Market,7.3 - 10 triệu,https://www.topcv.vn/viec-lam/nhan-vien-thu-ngan-van-hanh-online-apps/1602361.html?ta_source=JobSearchList_LinkDetail&u_sr_id=41xKsCt6oTR8qJeOXslC50sXuoOJbolXedZyH5X2_1776614713
94,QA Tester (Game/Web) Thu Nhập Up To 30M - Nhận Việc Ngay,CÔNG TY TNHH BPO BLUENOVA SOLUTIONS,10 - 30 triệu,https://www.topcv.vn/viec-lam/qa-tester-game-web-thu-nhap-up-to-30m-nhan-viec-ngay/2125006.html?ta_source=JobSearchList_LinkDetail&u_sr_id=41xKsCt6oTR8qJeOXslC50sXuoOJbolXedZyH5X2_1776614713
95,Admin Bất Động Sản - Thu Nhập 8 - 15 Triệu ( Quận 7 - Hồ Chí Minh ),CÔNG TY CỔ PHẦN HANA HOUSING,8 - 15 triệu,https://www.topcv.vn/viec-lam/admin-bat-dong-san-thu-nhap-8-15-trieu-quan-7-ho-chi-minh/2112024.html?ta_source=JobSearchList_LinkDetail&u_sr_id=41xKsCt6oTR8qJeOXslC50sXuoOJbolXedZyH5X2_1776614713
96,"Nhân Viên Kỹ Thuật Lắp Ráp Máy Tính (PC, Laptop)",Công ty TNHH TIN HỌC NGÔI SAO LỚN,7 - 12 triệu,https://www.topcv.vn/viec-lam/nhan-vien-ky-thuat-lap-rap-may-tinh-pc-laptop/2116719.html?ta_source=JobSearchList_LinkDetail&u_sr_id=41xKsCt6oTR8qJeOXslC50sXuoOJbolXedZyH5X2_1776614713
97,Nhân Viên Kinh Doanh,CÔNG TY CỔ PHẦN DỊCH VỤ HÀNG HẢI HÀNG KHÔNG CON CÁ HEO,Thoả thuận,https://www.topcv.vn/viec-lam/nhan-vien-kinh-doanh/1990384.html?ta_source=JobSearchList_LinkDetail&u_sr_id=41xKsCt6oTR8qJeOXslC50sXuoOJbolXedZyH5X2_1776614713
98,Nhân Viên Mua Hàng ( Có Đào Tạo ) Lương 8-14 Triệu - Khu Vực Hoài Đức  - Hà Nội,Công ty Cổ phần Đầu tư và Sản xuất Công nghiệp BCM,8 - 14 triệu,https://www.topcv.vn/viec-lam/nhan-vien-mua-hang-co-dao-tao-luong-8-14-trieu-khu-vuc-hoai-duc-ha-noi/2112679.html?ta_source=JobSearchList_LinkDetail&u_sr_id=41xKsCt6oTR8qJeOXslC50sXuoOJbolXedZyH5X2_1776614713
99,Nhân Viên Thiết Kế Đồ Họa - Đi Làm Ngay,CÔNG TY CỔ PHẦN GIẢI TRÍ PERFECT UNIVERSE,10 - 13 triệu,https://www.topcv.vn/viec-lam/nhan-vien-thiet-ke-do-hoa-di-lam-ngay/2115104.html?ta_source=JobSearchList_LinkDetail&u_sr_id=41xKsCt6oTR8qJeOXslC50sXuoOJbolXedZyH5X2_1776614713
100,Kỹ Sư Giải Pháp An Ninh Bảo Mật,CÔNG TY CÔNG NGHỆ THÔNG TIN ĐIỆN LỰC MIỀN BẮC - CHI NHÁNH TỔNG CÔNG TY ĐIỆN LỰC MIỀN BẮC,Thoả thuận,https://www.topcv.vn/viec-lam/ky-su-giai-phap-an-ninh-bao-mat/2114942.html?ta_source=JobSearchList_LinkDetail&u_sr_id=41xKsCt6oTR8qJeOXslC50sXuoOJbolXedZyH5X2_1776614713
