STT,Tiêu đề,Công ty,Lương,Link
1,Trưởng Phòng Kinh Doanh Bất Động Sản (Hỗ Trợ MKT) - LCB Từ 9 Triệu/Hoa Hồng 80 Triệu Đến 200 Triệu/Căn,CÔNG TY CỔ PHẦN SÀN GIAO DỊCH BẤT ĐỘNG SẢN TERA,80 - 200 triệu,https://www.topcv.vn/viec-lam/truong-phong-kinh-doanh-bat-dong-san-ho-tro-mkt-lcb-tu-9-trieu-hoa-hong-80-trieu-den-200-trieu-can/2108385.html?ta_source=JobSearchList_LinkDetail&u_sr_id=41xKsCt6oTR8qJeOXslC50sXuoOJbolXedZyH5X2_1776614709
2,Nhân Viên Kinh Doanh/ Sales/ Tư Vấn _ Làm Việc Tại Hồ Chí Minh,CÔNG TY CỔ PHẦN DỊCH VỤ CÔNG NGHỆ SÀI GÒN,Thoả thuận,https://www.topcv.vn/viec-lam/nhan-vien-kinh-doanh-sales-tu-van-lam-viec-tai-ho-chi-minh/2105178.html?ta_source=JobSearchList_LinkDetail&u_sr_id=41xKsCt6oTR8qJeOXslC50sXuoOJbolXedZyH5X2_1776614709
3,Nhân Viên Tư Vấn/ Sale Online/ Chăm Sóc Khách Hàng (Game) - Thu Nhập Hấp Dẫn,Công Ty TNHH CNLGAMING,Từ 12 triệu,https://www.topcv.vn/viec-lam/nhan-vien-tu-van-sale-online-cham-soc-khach-hang-game-thu-nhap-hap-dan/1662973.html?ta_source=JobSearchList_LinkDetail&u_sr_id=41xKsCt6oTR8qJeOXslC50sXuoOJbolXedZyH5X2_1776614709
4,Trợ Lý Vận Hành - Sales Admin - Không Yêu Cầu Kinh Nghiệm - Đi Làm Ngay (Hà Nội & Quận 6 HCM),Công ty Cổ phần Đầu tư Fiveland,Từ 8.5 triệu,https://www.topcv.vn/viec-lam/tro-ly-van-hanh-sales-admin-khong-yeu-cau-kinh-nghiem-di-lam-ngay-ha-noi-quan-6-hcm/2112784.html?ta_source=JobSearchList_LinkDetail&u_sr_id=41xKsCt6oTR8qJeOXslC50sXuoOJbolXedZyH5X2_1776614709
5,Intern Digital Marketing | Performance - Ads - Ecommerce Quốc Tế | Hồ Chí Minh  - Thu Nhập 10-25TR,CÔNG TY TNHH ADIFY,6 - 25 triệu,https://www.topcv.vn/viec-lam/intern-digital-marketing-performance-ads-ecommerce-quoc-te-ho-chi-minh-thu-nhap-10-25tr/2112239.html?ta_source=JobSearchList_LinkDetail&u_sr_id=41xKsCt6oTR8qJeOXslC50sXuoOJbolXedZyH5X2_1776614709
6,Nhân Viên Văn Phòng Hỗ Trợ Phần Mềm & CSKH,CÔNG TY CỔ PHẦN ĐẦU TƯ CÔNG NGHỆ VÀ THƯƠNG MẠI SOFTDREAMS,8 - 12 triệu,https://www.topcv.vn/brand/softdreams/tuyen-dung/nhan-vien-van-phong-ho-tro-phan-mem-cskh-j2113267.html?ta_source=JobSearchList_LinkDetail&u_sr_id=41xKsCt6oTR8qJeOXslC50sXuoOJbolXedZyH5X2_1776614709
7,Nhân Viên Chăm Sóc Khách Hàng,CÔNG TY CỔ PHẦN DỊCH VỤ HÀNG HẢI HÀNG KHÔNG CON CÁ HEO,Thoả thuận,https://www.topcv.vn/viec-lam/nhan-vien-cham-soc-khach-hang/1334710.html?ta_source=JobSearchList_LinkDetail&u_sr_id=41xKsCt6oTR8qJeOXslC50sXuoOJbolXedZyH5X2_1776614709
8,Chuyên Viên Chính Truyền Thông Marketing - Hà Nội - TA161 - ID3218,Ngân Hàng TMCP Việt Nam Thịnh Vượng (VPBank),Thoả thuận,https://www.topcv.vn/brand/vpbank/tuyen-dung/chuyen-vien-chinh-truyen-thong-marketing-ha-noi-ta161-id3218-j2111498.html?ta_source=JobSearchList_LinkDetail&u_sr_id=41xKsCt6oTR8qJeOXslC50sXuoOJbolXedZyH5X2_1776614709
9,"Chuyên Viên Cao Cấp Phát Triển Ứng Dụng Kênh Ngân Hàng Số (Java, .Net)",Ngân Hàng Thương Mại Cổ Phần Thịnh Vượng Và Phát Triển – PGBank,Thoả thuận,https://www.topcv.vn/viec-lam/chuyen-vien-cao-cap-phat-trien-ung-dung-kenh-ngan-hang-so-java-net/1897077.html?ta_source=JobSearchList_LinkDetail&u_sr_id=41xKsCt6oTR8qJeOXslC50sXuoOJbolXedZyH5X2_1776614709
10,Thực Tập Sinh Truyền Thông - Sự Kiện Có Lương (Có Dấu),CÔNG TY CỔ PHẦN DỊCH VỤ TRANG TRÍ VÀ SỰ KIỆN ZINA,3 - 5 triệu,https://www.topcv.vn/viec-lam/thuc-tap-sinh-truyen-thong-su-kien-co-luong-co-dau/1823701.html?ta_source=JobSearchList_LinkDetail&u_sr_id=41xKsCt6oTR8qJeOXslC50sXuoOJbolXedZyH5X2_1776614709
11,Hành Chính Nhân Sự,CÔNG TY TNHH CHÂU DUY PHÁT,Thoả thuận,https://www.topcv.vn/viec-lam/hanh-chinh-nhan-su/2111296.html?ta_source=JobSearchList_LinkDetail&u_sr_id=41xKsCt6oTR8qJeOXslC50sXuoOJbolXedZyH5X2_1776614709
12,Graphic Designer - Chuyên Viên Thiết Kế Đồ Họa (Quận 5 HCM Cũ),CÔNG TY TNHH DU HỌC TẬN TÂM,Thoả thuận,https://www.topcv.vn/viec-lam/graphic-designer-chuyen-vien-thiet-ke-do-hoa-quan-5-hcm-cu/2115371.html?ta_source=JobSearchList_LinkDetail&u_sr_id=41xKsCt6oTR8qJeOXslC50sXuoOJbolXedZyH5X2_1776614709
13,Chuyên Viên Tuyển Dụng Công Nhân,CÔNG TY CỔ PHẦN PHÁT TRIỂN VÀ ĐẦU TƯ XÂY DỰNG VINCONS,15 - 20 triệu,https://www.topcv.vn/viec-lam/chuyen-vien-tuyen-dung-cong-nhan/2110393.html?ta_source=JobSearchList_LinkDetail&u_sr_id=41xKsCt6oTR8qJeOXslC50sXuoOJbolXedZyH5X2_1776614709
14,Nhân Viên Tiếng Nhật - Đi Làm Ngay Tại Đà Nẵng,CÔNG TY TNHH DTP PLUS DA NANG,7 - 10 triệu,https://www.topcv.vn/viec-lam/nhan-vien-tieng-nhat-di-lam-ngay-tai-da-nang/2125504.html?ta_source=JobSearchList_LinkDetail&u_sr_id=41xKsCt6oTR8qJeOXslC50sXuoOJbolXedZyH5X2_1776614709
15,"Nhân Viên Thiết Kế Nhãn, Bao Bì Sản Phẩm - Từ 2 Năm Kinh Nghiệm, Thu Nhập Đến 15 Triệu, Đi Làm Ngay",CÔNG TY TNHH GOOD HEART,10 - 15 triệu,https://www.topcv.vn/viec-lam/nhan-vien-thiet-ke-nhan-bao-bi-san-pham-tu-2-nam-kinh-nghiem-thu-nhap-den-15-trieu-di-lam-ngay/2110426.html?ta_source=JobSearchList_LinkDetail&u_sr_id=41xKsCt6oTR8qJeOXslC50sXuoOJbolXedZyH5X2_1776614709
16,"Nhân Viên Giao Nhận , Thủ Tục Hải Quan ( OPS ) Tại Hải Phòng_ Thu Nhập Upto 15.000.000",CHI NHÁNH CÔNG TY CỔ PHẦN VẬN TẢI TOÀN CẦU VIỆT NAM,10 - 15 triệu,https://www.topcv.vn/viec-lam/nhan-vien-giao-nhan-thu-tuc-hai-quan-ops-tai-hai-phong-thu-nhap-upto-15-000-000/2112249.html?ta_source=JobSearchList_LinkDetail&u_sr_id=41xKsCt6oTR8qJeOXslC50sXuoOJbolXedZyH5X2_1776614709
17,"Nhân Viên Bảo Trì Điện, Điện Lạnh/ Kỹ Thuật Vận Hành - Lương Từ 10-14 Triệu (Hồ Chí Minh, Hà Nội)",Công ty TNHH Kootoro Việt Nam,10 - 14 triệu,https://www.topcv.vn/viec-lam/nhan-vien-bao-tri-dien-dien-lanh-ky-thuat-van-hanh-luong-tu-10-14-trieu-ho-chi-minh-ha-noi/2115352.html?ta_source=JobSearchList_LinkDetail&u_sr_id=41xKsCt6oTR8qJeOXslC50sXuoOJbolXedZyH5X2_1776614709
18,Nhân Viên Hành Chính Tổng Hợp ( 1 Năm Kinh Nghiệm ) - Lương 8-11 Triệu - Khu Vực Phường Cầu Giấy,Công ty Cổ phần Đầu tư và Sản xuất Công nghiệp BCM,8 - 11 triệu,https://www.topcv.vn/viec-lam/nhan-vien-hanh-chinh-tong-hop-1-nam-kinh-nghiem-luong-8-11-trieu-khu-vuc-phuong-cau-giay/2112615.html?ta_source=JobSearchList_LinkDetail&u_sr_id=41xKsCt6oTR8qJeOXslC50sXuoOJbolXedZyH5X2_1776614709
19,Chuyên Viên Chăm Sóc Khách Hàng (Mảng Vận Hành Nhà Chung Cư),Công ty CP Vinhomes,Thoả thuận,https://www.topcv.vn/viec-lam/chuyen-vien-cham-soc-khach-hang-mang-van-hanh-nha-chung-cu/2109986.html?ta_source=JobSearchList_LinkDetail&u_sr_id=41xKsCt6oTR8qJeOXslC50sXuoOJbolXedZyH5X2_1776614709
20,"Nhân Viên Kế Toán Nội Bộ (Không Yêu Cầu Kinh Nghiệm)-[Chấp Nhận Sinh Viên Đang Chờ Bằng] Tại Quận 7, Quận 11, Quận 12 Hồ Chí Minh",CÔNG TY CỔ PHẦN DONG SHOP SUN,8.5 - 10 triệu,https://www.topcv.vn/viec-lam/nhan-vien-ke-toan-noi-bo-khong-yeu-cau-kinh-nghiem-chap-nhan-sinh-vien-dang-cho-bang-tai-quan-7-quan-11-quan-12-ho-chi-minh/678713.html?ta_source=JobSearchList_LinkDetail&u_sr_id=41xKsCt6oTR8qJeOXslC50sXuoOJbolXedZyH5X2_1776614709
21,Biên Tập Viên Tiếng Hàn - Lương Hấp Dẫn - Dưới 1 Năm Kinh Nghiệm (Hà Nội),CÔNG TY CỔ PHẦN XUẤT BẢN VÀ TRUYỀN THÔNG IPM,Thoả thuận,https://www.topcv.vn/viec-lam/bien-tap-vien-tieng-han-luong-hap-dan-duoi-1-nam-kinh-nghiem-ha-noi/2112145.html?ta_source=JobSearchList_LinkDetail&u_sr_id=41xKsCt6oTR8qJeOXslC50sXuoOJbolXedZyH5X2_1776614709
22,Quản Lý Thi Công/ Chỉ Huy Trưởng Mảng Dân Dụng (Làm Tại Hà Nội),CÔNG TY CỔ PHẦN TƯ VẤN VÀ THIẾT KẾ KIẾN TRÚC KIẾN GROUP,20 - 30 triệu,https://www.topcv.vn/viec-lam/quan-ly-thi-cong-chi-huy-truong-mang-dan-dung-lam-tai-ha-noi/2112495.html?ta_source=JobSearchList_LinkDetail&u_sr_id=41xKsCt6oTR8qJeOXslC50sXuoOJbolXedZyH5X2_1776614709
23,Gia Sư THCS/THPT Toán/ Lý/ Hóa/ Văn/ Sinh/ KHTN (Thu Nhập 5-10M/Tháng _ Làm Tại Nhà/Remote _ Nhận Việc Ngay),CÔNG TY CỔ PHẦN CÔNG NGHỆ MARATHON EDUCATION,5 - 10 triệu,https://www.topcv.vn/viec-lam/gia-su-thcs-thpt-toan-ly-hoa-van-sinh-khtn-thu-nhap-5-10m-thang-lam-tai-nha-remote-nhan-viec-ngay/2054069.html?ta_source=JobSearchList_LinkDetail&u_sr_id=41xKsCt6oTR8qJeOXslC50sXuoOJbolXedZyH5X2_1776614709
24,Nhân Viên Văn Phòng (Tư Vấn-Ghi Danh) Nữ - Hồ Chí Minh - Đi Làm Ngay,Công ty TNHH Tư vấn & Dịch vụ Chuyên Việt,9 - 15 triệu,https://www.topcv.vn/viec-lam/nhan-vien-van-phong-tu-van-ghi-danh-nu-ho-chi-minh-di-lam-ngay/2056106.html?ta_source=JobSearchList_LinkDetail&u_sr_id=41xKsCt6oTR8qJeOXslC50sXuoOJbolXedZyH5X2_1776614709
25,Chuyên Viên Hành Chính Nhân Sự - Làm Việc Tại Quận 02 - Đi Làm Ngay,CÔNG TY CỔ PHẦN MASFICO VIỆT NAM,12 - 17 triệu,https://www.topcv.vn/viec-lam/chuyen-vien-hanh-chinh-nhan-su-lam-viec-tai-quan-02-di-lam-ngay/2109545.html?ta_source=JobSearchList_LinkDetail&u_sr_id=41xKsCt6oTR8qJeOXslC50sXuoOJbolXedZyH5X2_1776614709
26,Chuyên Viên Tìm Kiếm Mặt Bằng (Lương Cứng 20tr),CÔNG TY CỔ PHẦN PHÁT TRIỂN TRẠM SẠC TOÀN CẦU V-GREEN,20 - 21 triệu,https://www.topcv.vn/viec-lam/chuyen-vien-tim-kiem-mat-bang-luong-cung-20tr/2059189.html?ta_source=JobSearchList_LinkDetail&u_sr_id=41xKsCt6oTR8qJeOXslC50sXuoOJbolXedZyH5X2_1776614709
27,Nhân Viên Kinh Doanh Thị Trường (Thu Nhập Lên Đến 25tr/ Tháng) - Đi Làm Ngay,CÔNG TY CỔ PHẦN DỊCH VỤ DI ĐỘNG TRỰC TUYẾN,15 - 25 triệu,https://www.topcv.vn/viec-lam/nhan-vien-kinh-doanh-thi-truong-thu-nhap-len-den-25tr-thang-di-lam-ngay/2109964.html?ta_source=JobSearchList_LinkDetail&u_sr_id=41xKsCt6oTR8qJeOXslC50sXuoOJbolXedZyH5X2_1776614709
28,HRBP Executive,CÔNG TY CỔ PHẦN DỊCH VỤ GIAO HÀNG NHANH,13 - 16 triệu,https://www.topcv.vn/viec-lam/hrbp-executive/2111506.html?ta_source=JobSearchList_LinkDetail&u_sr_id=41xKsCt6oTR8qJeOXslC50sXuoOJbolXedZyH5X2_1776614709
29,Giáo Viên Tiếng Trung (Thu Nhập 9 - 15 Triệu),SPARK EDUCATION LIMITED COMPANY,9 - 15 triệu,https://www.topcv.vn/viec-lam/giao-vien-tieng-trung-thu-nhap-9-15-trieu/2115536.html?ta_source=JobSearchList_LinkDetail&u_sr_id=41xKsCt6oTR8qJeOXslC50sXuoOJbolXedZyH5X2_1776614709
30,Sales Admin,CÔNG TY TNHH THƯƠNG MẠI VÀ DỊCH VỤ CỬU LONG MEKO,Thoả thuận,https://www.topcv.vn/viec-lam/sales-admin/2102909.html?ta_source=JobSearchList_LinkDetail&u_sr_id=41xKsCt6oTR8qJeOXslC50sXuoOJbolXedZyH5X2_1776614709
31,"Fullstack Team Lead (NodeJS / ReactJS) - 5 Năm Kinh Nghiệm - Làm Việc Tại Lê Đức Thọ, HN - Phúc Lợi Tốt, Thu Nhập 25 Triệu +++",CÔNG TY CỔ PHẦN YANSOFT,Từ 25 triệu,https://www.topcv.vn/viec-lam/fullstack-team-lead-nodejs-reactjs-5-nam-kinh-nghiem-lam-viec-tai-le-duc-tho-hn-phuc-loi-tot-thu-nhap-25-trieu/2116548.html?ta_source=JobSearchList_LinkDetail&u_sr_id=41xKsCt6oTR8qJeOXslC50sXuoOJbolXedZyH5X2_1776614709
32,Nhân Viên Hành Chính,CÔNG TY CỔ PHẦN DƯỢC PHẨM MINH KỲ,Thoả thuận,https://www.topcv.vn/viec-lam/nhan-vien-hanh-chinh/2109713.html?ta_source=JobSearchList_LinkDetail&u_sr_id=41xKsCt6oTR8qJeOXslC50sXuoOJbolXedZyH5X2_1776614709
33,"Biên Dịch Tiếng Trung, Không Yêu Cầu Kinh Nghiệm, Thu Nhập Hấp Dẫn Từ 9 - 15 Triệu",CÔNG TY TNHH GST,9 - 15 triệu,https://www.topcv.vn/viec-lam/bien-dich-tieng-trung-khong-yeu-cau-kinh-nghiem-thu-nhap-hap-dan-tu-9-15-trieu/2111669.html?ta_source=JobSearchList_LinkDetail&u_sr_id=41xKsCt6oTR8qJeOXslC50sXuoOJbolXedZyH5X2_1776614709
34,Giáo Viên Toán Online,CÔNG TY CỔ PHẦN DREAM VIET EDUCATION,2 - 10 triệu,https://www.topcv.vn/viec-lam/giao-vien-toan-online/2109933.html?ta_source=JobSearchList_LinkDetail&u_sr_id=41xKsCt6oTR8qJeOXslC50sXuoOJbolXedZyH5X2_1776614709
35,Tester  - Thu Nhập Hấp Dẫn - Tại Hà Nội,CÔNG TY TNHH EKYO VIỆT NAM,Thoả thuận,https://www.topcv.vn/viec-lam/tester-thu-nhap-hap-dan-tai-ha-noi/2110759.html?ta_source=JobSearchList_LinkDetail&u_sr_id=41xKsCt6oTR8qJeOXslC50sXuoOJbolXedZyH5X2_1776614709
36,Nhân Viên Khai Báo Hải Quan ( Hồ Chí Minh),CÔNG TY TNHH THƯƠNG MẠI DỊCH VỤ VẬN TẢI VIỆT Á,Thoả thuận,https://www.topcv.vn/viec-lam/nhan-vien-khai-bao-hai-quan-ho-chi-minh/2111635.html?ta_source=JobSearchList_LinkDetail&u_sr_id=41xKsCt6oTR8qJeOXslC50sXuoOJbolXedZyH5X2_1776614709
37,Thực Tập Sinh Phân Tích & Triển Khai Nghiệp Vụ,Công ty cổ phần công nghệ Isofh,4 - 5 triệu,https://www.topcv.vn/viec-lam/thuc-tap-sinh-phan-tich-trien-khai-nghiep-vu/1683712.html?ta_source=JobSearchList_LinkDetail&u_sr_id=41xKsCt6oTR8qJeOXslC50sXuoOJbolXedZyH5X2_1776614709
38,Kế Toán Nội Bộ,CHAM JEWELRY,8.5 - 12 triệu,https://www.topcv.vn/viec-lam/ke-toan-noi-bo/2110417.html?ta_source=JobSearchList_LinkDetail&u_sr_id=41xKsCt6oTR8qJeOXslC50sXuoOJbolXedZyH5X2_1776614709
39,Brand Marketing Manager (Mảng Làm Đẹp) Lương Cứng Từ 20-30 Triệu/Tháng,CÔNG TY TNHH DỊCH VỤ VÀ THƯƠNG MẠI MSC,20 - 40 triệu,https://www.topcv.vn/brand/amiagroup/tuyen-dung/brand-marketing-manager-mang-lam-dep-luong-cung-tu-20-30-trieu-thang-j2043596.html?ta_source=JobSearchList_LinkDetail&u_sr_id=41xKsCt6oTR8qJeOXslC50sXuoOJbolXedZyH5X2_1776614709
40,Nhân Viên Dự Án (Lương 10 - 20 Triệu) Nghỉ Thứ 7 - Chủ Nhật,CÔNG TY CỔ PHẦN ĐẦU TƯ FIVE STARS VIỆT NAM,Thoả thuận,https://www.topcv.vn/viec-lam/nhan-vien-du-an-luong-10-20-trieu-nghi-thu-7-chu-nhat/2110423.html?ta_source=JobSearchList_LinkDetail&u_sr_id=41xKsCt6oTR8qJeOXslC50sXuoOJbolXedZyH5X2_1776614709
41,Giáo Viên Tiếng Anh (Thu Nhập 9 - 15 Triệu),SPARK EDUCATION LIMITED COMPANY,9 - 15 triệu,https://www.topcv.vn/viec-lam/giao-vien-tieng-anh-thu-nhap-9-15-trieu/2115686.html?ta_source=JobSearchList_LinkDetail&u_sr_id=41xKsCt6oTR8qJeOXslC50sXuoOJbolXedZyH5X2_1776614709
42,Trưởng Phòng Marketing (Nhận Việc Ngay),CÔNG TY TNHH CYBERCORE VIỆT NAM,20 - 25 triệu,https://www.topcv.vn/viec-lam/truong-phong-marketing-nhan-viec-ngay/1662139.html?ta_source=JobSearchList_LinkDetail&u_sr_id=41xKsCt6oTR8qJeOXslC50sXuoOJbolXedZyH5X2_1776614709
43,"Vị Trí Marketing Sale Parttime Phù Hợp Với Sinh Vên Năm 2,3,4 - Cho Thuê Chung Cư - Căn Hộ Dịch Vụ/ Phòng Trọ - Thời Gian Linh Động - Từ 4-6 Triệu - Ưu Tiên Sinh Viên",CÔNG TY TNHH HỖ TRỢ TƯ VẤN DỊCH VỤ E-HOME,6 - 12 triệu,https://www.topcv.vn/viec-lam/vi-tri-marketing-sale-parttime-phu-hop-voi-sinh-ven-nam-2-3-4-cho-thue-chung-cu-can-ho-dich-vu-phong-tro-thoi-gian-linh-dong-tu-4-6-trieu-uu-tien-sinh-vien/1417349.html?ta_source=JobSearchList_LinkDetail&u_sr_id=41xKsCt6oTR8qJeOXslC50sXuoOJbolXedZyH5X2_1776614709
44,Manual Tester,CÔNG TY CỔ PHẦN CÔNG NGHỆ AIT,15 - 25 triệu,https://www.topcv.vn/viec-lam/manual-tester/2049974.html?ta_source=JobSearchList_LinkDetail&u_sr_id=41xKsCt6oTR8qJeOXslC50sXuoOJbolXedZyH5X2_1776614709
45,"Nhân Viên Tư Vấn Thiết Kế Website, App, Phần Mềm",CÔNG TY TNHH CÔNG NGHỆ PHẦN MỀM NASANI,7 - 25 triệu,https://www.topcv.vn/viec-lam/nhan-vien-tu-van-thiet-ke-website-app-phan-mem/2110275.html?ta_source=JobSearchList_LinkDetail&u_sr_id=41xKsCt6oTR8qJeOXslC50sXuoOJbolXedZyH5X2_1776614709
46,Chuyên Viên Hành Chính  Nhân Sự,Công ty Cổ Phần Cá Heo Xanh,12 - 15 triệu,https://www.topcv.vn/viec-lam/chuyen-vien-hanh-chinh-nhan-su/2114113.html?ta_source=JobSearchList_LinkDetail&u_sr_id=41xKsCt6oTR8qJeOXslC50sXuoOJbolXedZyH5X2_1776614709
47,"Chăm Sóc Khách Hàng [Hồ Chí Minh] - Lương Cơ Bản 10-13 Triệu, Không Áp Doanh Số",Công ty cổ phần tập đoàn công nghệ Quảng Ích,10 - 13 triệu,https://www.topcv.vn/viec-lam/cham-soc-khach-hang-ho-chi-minh-luong-co-ban-10-13-trieu-khong-ap-doanh-so/2114167.html?ta_source=JobSearchList_LinkDetail&u_sr_id=41xKsCt6oTR8qJeOXslC50sXuoOJbolXedZyH5X2_1776614709
48,Trưởng Phòng Kinh Doanh / Sales Manager - Tân Phú - Đi Làm Ngay,Công ty TNHH TMDV Tâm Minh Quân,20 - 40 triệu,https://www.topcv.vn/viec-lam/truong-phong-kinh-doanh-sales-manager-tan-phu-di-lam-ngay/2115327.html?ta_source=JobSearchList_LinkDetail&u_sr_id=41xKsCt6oTR8qJeOXslC50sXuoOJbolXedZyH5X2_1776614709
49,Kế Toán Tổng Hợp - Nội Bộ | Đi Làm Ngay,CÔNG TY TNHH TWIN TECH VIỆT NAM,13 - 18 triệu,https://www.topcv.vn/viec-lam/ke-toan-tong-hop-noi-bo-di-lam-ngay/2109983.html?ta_source=JobSearchList_LinkDetail&u_sr_id=41xKsCt6oTR8qJeOXslC50sXuoOJbolXedZyH5X2_1776614709
50,"Giáo Viên Toán Tư Duy Cấp Mầm Non/Tiểu Học & THCS (Hà Nội, Hải Phòng/ TP.HCM  Và Đồng Nai) - Nhận Việc Ngay",Mathnasium Việt Nam,8 - 12 triệu,https://www.topcv.vn/viec-lam/giao-vien-toan-tu-duy-cap-mam-non-tieu-hoc-thcs-ha-noi-hai-phong-tp-hcm-va-dong-nai-nhan-viec-ngay/1966064.html?ta_source=JobSearchList_LinkDetail&u_sr_id=41xKsCt6oTR8qJeOXslC50sXuoOJbolXedZyH5X2_1776614709
51,Phụ Trách Thu Mua Tại Hồ Chí Minh - NHẬN VIỆC NGAY,CÔNG TY CỔ PHẦN THÉP POVINA,Thoả thuận,https://www.topcv.vn/viec-lam/phu-trach-thu-mua-tai-ho-chi-minh-nhan-viec-ngay/2114467.html?ta_source=JobSearchList_LinkDetail&u_sr_id=41xKsCt6oTR8qJeOXslC50sXuoOJbolXedZyH5X2_1776614713
52,Product Builder (Remote),CÔNG TY CỔ PHẦN KIMQ,Thoả thuận,https://www.topcv.vn/viec-lam/product-builder-remote/2111290.html?ta_source=JobSearchList_LinkDetail&u_sr_id=41xKsCt6oTR8qJeOXslC50sXuoOJbolXedZyH5X2_1776614713
53,Phó Phòng Marketing - Dược Phẩm,CÔNG TY CỔ PHẦN VISTAFA,25 - 30 triệu,https://www.topcv.vn/viec-lam/pho-phong-marketing-duoc-pham/2112255.html?ta_source=JobSearchList_LinkDetail&u_sr_id=41xKsCt6oTR8qJeOXslC50sXuoOJbolXedZyH5X2_1776614713
54,Chương Trình Tài Năng Trẻ TopCV Mùa 2 - TopCV Next Gen 2026,Công ty Cổ phần TOPCV Việt Nam,Thoả thuận,https://www.topcv.vn/brand/topcv/tuyen-dung/chuong-trinh-tai-nang-tre-topcv-mua-2-topcv-next-gen-2026-j2104855.html?ta_source=JobSearchList_LinkDetail&u_sr_id=41xKsCt6oTR8qJeOXslC50sXuoOJbolXedZyH5X2_1776614713
55,Nhân Viên Kỹ Thuật Bảo Trì - Bình Dương,CÔNG TY TNHH HERGENG ENTERPRISE VN,10 - 14 triệu,https://www.topcv.vn/viec-lam/nhan-vien-ky-thuat-bao-tri-binh-duong/2108261.html?ta_source=JobSearchList_LinkDetail&u_sr_id=41xKsCt6oTR8qJeOXslC50sXuoOJbolXedZyH5X2_1776614713
56,Kế Toán Viên - Không Yêu Cầu Kinh Nghiệm - Được Đào Tạo - Thu Nhập 12 - 14Tr - Đi Làm Ngay,CÔNG TY TNHH DƯỢC PHẨM TÂN THỊNH,12 - 14 triệu,https://www.topcv.vn/viec-lam/ke-toan-vien-khong-yeu-cau-kinh-nghiem-duoc-dao-tao-thu-nhap-12-14tr-di-lam-ngay/2109949.html?ta_source=JobSearchList_LinkDetail&u_sr_id=41xKsCt6oTR8qJeOXslC50sXuoOJbolXedZyH5X2_1776614713
57,Kỹ Sư Xây Dựng/ Giám Sát Thi Công/ Kỹ Thuật Hiện Trường - Không Yêu Cầu Kinh Nghiệm (Hà Nội) Đi Làm Ngay - Lương Tới 20 Triệu,CÔNG TY CỔ PHẦN KIẾN TRÚC VÀ XÂY DỰNG VIỆT PHÁT,Tới 20 triệu,https://www.topcv.vn/viec-lam/ky-su-xay-dung-giam-sat-thi-cong-ky-thuat-hien-truong-khong-yeu-cau-kinh-nghiem-ha-noi-di-lam-ngay-luong-toi-20-trieu/2110010.html?ta_source=JobSearchList_LinkDetail&u_sr_id=41xKsCt6oTR8qJeOXslC50sXuoOJbolXedZyH5X2_1776614713
58,Chuyên Viên Xây Dựng Và Bảo Trì Chuỗi Siêu Thị,Công ty Cổ Phần Con Cưng,Thoả thuận,https://www.topcv.vn/viec-lam/chuyen-vien-xay-dung-va-bao-tri-chuoi-sieu-thi/1528034.html?ta_source=JobSearchList_LinkDetail&u_sr_id=41xKsCt6oTR8qJeOXslC50sXuoOJbolXedZyH5X2_1776614713
59,Giám Sát Thi Công Hệ Thống ME,CÔNG TY TNHH TƯ VẤN XÂY DỰNG ĐỈNH CAO,Thoả thuận,https://www.topcv.vn/viec-lam/giam-sat-thi-cong-he-thong-me/2088110.html?ta_source=JobSearchList_LinkDetail&u_sr_id=41xKsCt6oTR8qJeOXslC50sXuoOJbolXedZyH5X2_1776614713
60,Trợ Lý Tổng Giám Đốc Kiêm Phiên Dịch ( Tiếng Trung Thành Thạo),CÔNG TY TNHH CÔNG NGHỆ FLETCHER VIỆT NAM,15 - 20 triệu,https://www.topcv.vn/viec-lam/tro-ly-tong-giam-doc-kiem-phien-dich-tieng-trung-thanh-thao/2109932.html?ta_source=JobSearchList_LinkDetail&u_sr_id=41xKsCt6oTR8qJeOXslC50sXuoOJbolXedZyH5X2_1776614713
61,Brand Manager (Thu Nhập 35-40M),CÔNG TY TNHH THỜI TRANG CALIE HOUSE,35 - 40 triệu,https://www.topcv.vn/viec-lam/brand-manager-thu-nhap-35-40m/2112383.html?ta_source=JobSearchList_LinkDetail&u_sr_id=41xKsCt6oTR8qJeOXslC50sXuoOJbolXedZyH5X2_1776614713
62,Kế Toán Công Nợ - Không Yêu Cầu Kinh Nghiệm - Lương Lên Đến 10 Triệu/Tháng - Tại Hồ Chí Minh,CÔNG TY TNHH 7STAR,8 - 10 triệu,https://www.topcv.vn/viec-lam/ke-toan-cong-no-khong-yeu-cau-kinh-nghiem-luong-len-den-10-trieu-thang-tai-ho-chi-minh/2110943.html?ta_source=JobSearchList_LinkDetail&u_sr_id=41xKsCt6oTR8qJeOXslC50sXuoOJbolXedZyH5X2_1776614713
63,Chủ Trì/ Kiểm Soát Thiết Kế Thu Nhập 40-50 Triệu,CÔNG TY CỔ PHẦN TƯ VẤN VÀ THIẾT KẾ KIẾN TRÚC KIẾN GROUP,40 - 50 triệu,https://www.topcv.vn/viec-lam/chu-tri-kiem-soat-thiet-ke-thu-nhap-40-50-trieu/2112480.html?ta_source=JobSearchList_LinkDetail&u_sr_id=41xKsCt6oTR8qJeOXslC50sXuoOJbolXedZyH5X2_1776614713
64,Chuyên Viên Kinh Doanh Tư Vấn Phần Mềm - Hộ Kinh Doanh,CÔNG TY CỔ PHẦN CÔNG NGHỆ KIOTVIET,15 - 30 triệu,https://www.topcv.vn/viec-lam/chuyen-vien-kinh-doanh-tu-van-phan-mem-ho-kinh-doanh/2110334.html?ta_source=JobSearchList_LinkDetail&u_sr_id=41xKsCt6oTR8qJeOXslC50sXuoOJbolXedZyH5X2_1776614713
65,"Trưởng Phòng Kinh Doanh Ngành Mỹ Phẩm Và FMCG (Hồ Chí Minh, Lương Cứng 25-30 Triệu, Thưởng Doanh Số Cao)",CÔNG TY TNHH XUẤT NHẬP KHẨU TỔNG HỢP MINH KHÔI,Từ 30 triệu,https://www.topcv.vn/viec-lam/truong-phong-kinh-doanh-nganh-my-pham-va-fmcg-ho-chi-minh-luong-cung-25-30-trieu-thuong-doanh-so-cao/2111361.html?ta_source=JobSearchList_LinkDetail&u_sr_id=41xKsCt6oTR8qJeOXslC50sXuoOJbolXedZyH5X2_1776614713
66,Nhân Viên Nhập Liệu Chứng Từ Kế Toán,CÔNG TY TNHH DU LỊCH VICTORIA,7 - 8 triệu,https://www.topcv.vn/viec-lam/nhan-vien-nhap-lieu-chung-tu-ke-toan/2110796.html?ta_source=JobSearchList_LinkDetail&u_sr_id=41xKsCt6oTR8qJeOXslC50sXuoOJbolXedZyH5X2_1776614713
67,Nhân Viên Hành Chính - Lễ Tân ( Hồ Chí Minh),CÔNG TY CỔ PHẦN TRUYỀN THÔNG  VÀNG CHÂU Á,13.5 - 15 triệu,https://www.topcv.vn/viec-lam/nhan-vien-hanh-chinh-le-tan-ho-chi-minh/2104540.html?ta_source=JobSearchList_LinkDetail&u_sr_id=41xKsCt6oTR8qJeOXslC50sXuoOJbolXedZyH5X2_1776614713
68,Quản Lý Cửa Hàng - Vạn Hạnh Mall/ Aeon Bình Dương. Thu Nhập 8.5tr-14tr,Công ty TNHH Minigood Việt Nam,8.5 - 14 triệu,https://www.topcv.vn/viec-lam/quan-ly-cua-hang-van-hanh-mall-aeon-binh-duong-thu-nhap-8-5tr-14tr/2110502.html?ta_source=JobSearchList_LinkDetail&u_sr_id=41xKsCt6oTR8qJeOXslC50sXuoOJbolXedZyH5X2_1776614713
69,Giao Dịch Viên - Toàn Quốc,Ngân Hàng Thương Mại Cổ Phần Kiên Long,Thoả thuận,https://www.topcv.vn/viec-lam/giao-dich-vien-toan-quoc/2111452.html?ta_source=JobSearchList_LinkDetail&u_sr_id=41xKsCt6oTR8qJeOXslC50sXuoOJbolXedZyH5X2_1776614713
70,Kỹ Sư Xây Dựng (Set Up Trạm Sạc),CÔNG TY CỔ PHẦN PHÁT TRIỂN TRẠM SẠC TOÀN CẦU V-GREEN,Thoả thuận,https://www.topcv.vn/viec-lam/ky-su-xay-dung-set-up-tram-sac/1875858.html?ta_source=JobSearchList_LinkDetail&u_sr_id=41xKsCt6oTR8qJeOXslC50sXuoOJbolXedZyH5X2_1776614713
71,"Giáo Viên Tiếng Anh (Tiểu Học - THCS - THPT, Hà Nội - Hải Phòng, 20-30 Triệu)",Edufit,15 - 22 triệu,https://www.topcv.vn/viec-lam/giao-vien-tieng-anh-tieu-hoc-thcs-thpt-ha-noi-hai-phong-20-30-trieu/2111239.html?ta_source=JobSearchList_LinkDetail&u_sr_id=41xKsCt6oTR8qJeOXslC50sXuoOJbolXedZyH5X2_1776614713
72,Kế Toán Viên,CÔNG TY CỔ PHẦN DƯỢC PHẨM MINH KỲ,Thoả thuận,https://www.topcv.vn/viec-lam/ke-toan-vien/2109717.html?ta_source=JobSearchList_LinkDetail&u_sr_id=41xKsCt6oTR8qJeOXslC50sXuoOJbolXedZyH5X2_1776614713
73,Thư Ký Mảng Truyền Thông,CÔNG TY CỔ PHẦN ĐẦU TƯ XÂY DỰNG BCONS,Thoả thuận,https://www.topcv.vn/viec-lam/thu-ky-mang-truyen-thong/2115198.html?ta_source=JobSearchList_LinkDetail&u_sr_id=41xKsCt6oTR8qJeOXslC50sXuoOJbolXedZyH5X2_1776614713
74,Kỹ Sư Lập Trình Và Phát Triển Phần Mềm,CÔNG TY CÔNG NGHỆ THÔNG TIN ĐIỆN LỰC MIỀN BẮC - CHI NHÁNH TỔNG CÔNG TY ĐIỆN LỰC MIỀN BẮC,Thoả thuận,https://www.topcv.vn/viec-lam/ky-su-lap-trinh-va-phat-trien-phan-mem/2114957.html?ta_source=JobSearchList_LinkDetail&u_sr_id=41xKsCt6oTR8qJeOXslC50sXuoOJbolXedZyH5X2_1776614713
75,Kiến Trúc Sư (Đi Làm Ngay),CÔNG TY TNHH TƯ VẤN THIẾT KẾ - XÂY DỰNG KIẾN TRÚC MỚI,Thoả thuận,https://www.topcv.vn/viec-lam/kien-truc-su-di-lam-ngay/2110011.html?ta_source=JobSearchList_LinkDetail&u_sr_id=41xKsCt6oTR8qJeOXslC50sXuoOJbolXedZyH5X2_1776614713
76,"Giám Sát Xây Dựng/ Công Trình - Lương Cứng 17-22 Triệu + Thưởng Dự Án, Tại Hồ Chí Minh & Tỉnh Lân Cận",CÔNG TY TNHH THƯƠNG MẠI KIẾN TRÚC XÂY DỰNG ĐỨC TÍN,17 - 22 triệu,https://www.topcv.vn/viec-lam/giam-sat-xay-dung-cong-trinh-luong-cung-17-22-trieu-thuong-du-an-tai-ho-chi-minh-tinh-lan-can/2115867.html?ta_source=JobSearchList_LinkDetail&u_sr_id=41xKsCt6oTR8qJeOXslC50sXuoOJbolXedZyH5X2_1776614713
77,Nhân Viên Biên Phiên Dịch Trung - Việt | 中越翻译服务岗,CÔNG TY TNHH MUYUAN VIỆT NAM,18 - 30 triệu,https://www.topcv.vn/viec-lam/nhan-vien-bien-phien-dich-trung-viet/2117282.html?ta_source=JobSearchList_LinkDetail&u_sr_id=41xKsCt6oTR8qJeOXslC50sXuoOJbolXedZyH5X2_1776614713
